{
  "schema": "AION_WITNESS_ENROLLMENT_BLUEPRINT_V4",
  "mode": "SYNTHETIC_ONLY",
  "root_id": "fixture-root",
  "root_public_key_hex": "aaaaaaaaaaaaaaaaaaaaaaaaaaaaaaaaaaaaaaaaaaaaaaaaaaaaaaaaaaaaaaaa",
  "witness_authorization": "UNKNOWN",
  "institutional_identity": "UNKNOWN",
  "custody_evidence": "UNKNOWN",
  "independent_receipt_channel": "UNKNOWN",
  "revocation_channel": "UNKNOWN",
  "operator_separation_evidence": "UNKNOWN",
  "root_rotation": "EXPLICIT_SEPARATE_OWNER_APPROVAL_REQUIRED",
  "exceptional_recovery": "EXPLICIT_SEPARATE_OWNER_APPROVAL_REQUIRED"
}
